{
  "$schema": "https://json-schema.org/draft/2020-12/schema",
  "$id": "https://orsted.example/schemas/vhplan-sap-order-1.json",
  "title": "VH-plan - ordre til oprettelse i SAP",
  "description": "Een fil pr. godkendt VH-plan. Skrives af flowet BioSap-VhPlan-SapOrder, naar planen staar i 'Ready for creation in SAP', og laeses af VH-plan Opretter (excel/opretter). Filen er et OEJEBLIKSBILLEDE af det, der blev godkendt: vaerdierne er SharePoints egne, kun renset for lookup- og valgobjekter. Al SAP-specifik oversaettelse (aktivitetstype -> ILART, prioritet -> noegle, startdato, kaldshorisont, vaerkskode) sker i opretteren, eet sted. Se docs/34-sap-oprettelse.md.",
  "type": "object",
  "required": ["kind", "version", "orderGuid", "createdOn", "environment", "plan", "items", "operations", "materials"],
  "additionalProperties": false,
  "properties": {
    "kind": { "const": "vhplan-sap-order" },
    "version": { "const": 1 },
    "orderGuid": {
      "type": "string",
      "pattern": "^[0-9a-fA-F]{8}-[0-9a-fA-F]{4}-[0-9a-fA-F]{4}-[0-9a-fA-F]{4}-[0-9a-fA-F]{12}$",
      "description": "Dannes af flowet (guid()) og skrives ogsaa paa planen i MaintenancePlans.SapOrderGuid. Kvitteringen skal baere den samme vaerdi, ellers afviser kvitteringsflowet den. Saa kan en kvittering for en gammel ordre aldrig skrive oven i en nyere."
    },
    "createdOn": { "type": "string", "format": "date-time", "description": "Hvornaar flowet byggede ordren (UTC)." },
    "environment": {
      "enum": ["DEV", "TEST", "PROD"],
      "description": "Hvilket SharePoint-miljoe data kommer fra. Opretteren spaerrer DEV og TEST mod produktions-SAP (GP1)."
    },
    "site": { "type": ["string", "null"], "description": "SharePoint-sitet, til fejlsoegning." },

    "plan": {
      "type": "object",
      "required": ["spId", "planId", "title", "plant", "cycle", "unit", "plannedDate"],
      "additionalProperties": false,
      "properties": {
        "spId": { "type": "integer", "description": "MaintenancePlans.ID" },
        "planId": { "type": "string", "pattern": "^MP[0-9]+$", "description": "MaintenancePlans.PlanID, fx MP0133" },
        "status": { "type": ["string", "null"], "description": "MaintenancePlans.Status paa det tidspunkt, ordren blev bygget" },
        "title": { "type": "string", "minLength": 1, "description": "MaintenancePlans.Title -> IP01 planens tekst (40 tegn i SAP)" },
        "plant": { "type": "string", "pattern": "^[A-Z]{3}$", "description": "MaintenancePlans.PlantsInitial, fx SSV. Opretteren slaar SAP-vaerket op i arket Opslag." },
        "strategyKey": { "type": ["string", "null"], "description": "MaintenancePlans.StrategyKey, fx '101'. Udfyldt = strategiplan: opretteren opretter den med strategien (VhpStrategy) og operationernes pakker (operations[].packagesKey). Kun tidsstrategier; en taellerstrategi afvises, indtil maalepunktet er klar." },
        "cycle": { "type": "number", "minimum": 0, "description": "MaintenancePlans.Cycle. 0 paa en strategiplan: pakkerne er cyklusserne." },
        "unit": { "type": ["string", "null"], "description": "MaintenancePlans.Unit: H, DAY, WK, MON eller YR. Tom paa en strategiplan." },
        "plannedDate": {
          "type": "string",
          "pattern": "^[0-9]{4}-[0-9]{2}-[0-9]{2}$",
          "description": "MaintenancePlans.PlannedDate som dansk kalenderdato (yyyy-mm-dd), dvs. foerste forfald. Opretteren saetter SAP's startdato EEN cyklus foer."
        },
        "sortField": { "type": ["string", "null"], "description": "SAP-noeglen fra SortField-opslaget (SortFieldList.Title), tre cifre, fx '080'. Foer Provision-SortFields.ps1 stod beskrivelsen her." },
        "sortFieldId": { "type": ["integer", "null"], "description": "SortField-opslagets Id i SortFieldList. Ikke SAP-noeglen." },
        "schedulingPeriod": { "type": ["number", "null"], "description": "MaintenancePlans.SchedulingPeriod, regnet af appen (CallHorizonMatrix). Opretteren bruger den; arket Opslag kun som reserve (R2-054)." },
        "schedulingPeriodUnit": { "type": ["string", "null"], "description": "MaintenancePlans.SchedulingPeriodUnit, fx 'YR'. Tom = YR." },
        "callHorizon": { "type": ["number", "null"], "description": "MaintenancePlans.CallHorizon (CallHorizon0), kaldshorisonten i procent. Opretteren bruger den; arket Opslag kun som reserve (R2-054)." },
        "requesterName": { "type": ["string", "null"] },
        "requesterEmail": { "type": ["string", "null"] },
        "appLink": { "type": ["string", "null"], "description": "Link til planen i appen" }
      }
    },

    "items": {
      "type": "array",
      "minItems": 1,
      "description": "Een raekke pr. raekke i MaintenanceItems for planen.",
      "items": {
        "type": "object",
        "required": ["spId", "title", "functionalLocation"],
        "additionalProperties": false,
        "properties": {
          "spId": { "type": "integer", "description": "MaintenanceItems.ID. Operationerne peger paa det med itemSpId." },
          "itemId": { "type": ["string", "null"], "description": "MaintenanceItems.ItemID, fx MI0179" },
          "title": { "type": "string", "minLength": 1, "description": "Kort tekst -> IP04 PSTXT og arbejdsplanens beskrivelse (40 tegn)" },
          "longText": { "type": ["string", "null"], "description": "MaintenanceItems.ItemDescription. HTML fra rich text-feltet. Uploades som langtekst i IP05." },
          "functionalLocation": { "type": "string", "minLength": 1, "description": "Itemets referenceobjekt -> IP04 TPLNR" },
          "objectList": { "type": ["string", "null"], "description": "MaintenanceItems.ObjectList som den staar: 'FL - tekst|||FL - tekst'. Opretteren tager FL'en foer ' - '." },
          "orderType": { "type": ["string", "null"], "description": "Valgets vaerdi, fx ZPRE -> IP04 AUART" },
          "activityType": { "type": ["string", "null"], "description": "Opslagets tekst, fx '102 - Predetermined Maintenance'. Opretteren tager de tre foerste tegn -> ILART." },
          "mainWorkCenter": { "type": ["string", "null"], "description": "Opslagets tekst, fx 'SSVAP'. Trimmes -> IP04 GEWERK og arbejdsplanens arbejdscenter." },
          "priority": { "type": ["string", "null"], "description": "Valgets tekst, fx 'Yellow (default)'. Opretteren laver den om til en noegle (1, 3, 6 ...)." },
          "userStatus": { "type": ["string", "null"], "description": "Valgets vaerdi, fx REPL" },
          "nonFlowUserStatus": { "type": ["string", "null"], "description": "Valgets vaerdi, fx ZBOW" },
          "revision": { "type": ["boolean", "null"], "description": "MaintenanceItems.Revision" },
          "revisionMark": { "type": ["string", "null"], "description": "Valgets tekst, fx 'REV - General Revision Mark'" },
          "responsibleInitials": { "type": ["string", "null"], "description": "MaintenanceItems.InitialOrstedResponsible -> IP04 ZZREVBY" }
        }
      }
    },

    "operations": {
      "type": "array",
      "description": "Een raekke pr. raekke i TaskListMain for planen. Hvert item faar sin egen arbejdsplan (IA05) med sine operationer i stigende operationsnummer.",
      "items": {
        "type": "object",
        "required": ["spId", "shortText"],
        "additionalProperties": false,
        "properties": {
          "spId": { "type": "integer", "description": "TaskListMain.ID" },
          "taskItemId": { "type": ["string", "null"], "description": "TaskListMain.TaskItemID, fx TI0437" },
          "itemSpId": { "type": ["integer", "null"], "description": "MaintenanceItemNo-opslagets Id = items[].spId" },
          "itemId": { "type": ["string", "null"], "description": "MaintenanceItemNo-opslagets tekst = items[].itemId" },
          "operationNo": { "type": ["number", "null"], "description": "TaskListMain.OperationNo (10, 20 ...). Kun til sortering: SAP nummererer selv." },
          "shortText": { "type": "string", "minLength": 1, "description": "-> IA05 LTXA1 (40 tegn)" },
          "longText": { "type": ["string", "null"], "description": "TaskListMain.LongText, HTML eller ren tekst" },
          "workCenter": { "type": ["string", "null"], "description": "TaskListMain.WorkCtr -> IA05 ARBPL" },
          "controlKey": { "type": ["string", "null"], "description": "TaskListMain.Ctrl: PM01, ZB01, PM02 eller PM03 -> IA05 STEUS" },
          "work": { "type": ["number", "null"], "description": "Timer -> IA05 ARBEI. Ved PM03 ogsaa ydelsens maengde." },
          "persons": { "type": ["number", "null"], "description": "TaskListMain.Num -> IA05 ANZZL" },
          "duration": { "type": ["number", "null"], "description": "TaskListMain.Duration. Ikke tastet: SAP regner den." },
          "vendor": { "type": ["string", "null"], "description": "TaskListMain.Vendor. Leverandoernummeret er de foranstillede cifre." },
          "price": { "type": ["number", "null"], "description": "TaskListMain.Price (DKK) -> IA05 PREIS ved PM02" },
          "currency": { "type": ["string", "null"] },
          "costElement": { "type": ["number", "null"], "description": "TaskListMain.CostElem. Tastes ikke i version 1." },
          "materialGroup": { "type": ["string", "null"], "description": "TaskListMain.MaterialGroup -> IA05 MATKL ved PM02 og PM03" },
          "serviceNo": { "type": ["string", "null"], "description": "TaskListMain.ServiceNo -> ydelsen ved PM03. Tom: opretteren slaar op i Opslag (Ydelser)." },
          "packagesKey": { "type": ["string", "null"], "description": "Pakkeallokeringen ';1;3;'. Kun relevant for strategiplaner." }
        }
      }
    },

    "materials": {
      "type": "array",
      "description": "Een raekke pr. raekke i MD_TasklistMaterial for planen. Version 1 af opretteren opretter dem IKKE i SAP, men viser dem som en advarsel, saa de tilfoejes i haanden.",
      "items": {
        "type": "object",
        "required": ["spId", "materialNo"],
        "additionalProperties": false,
        "properties": {
          "spId": { "type": "integer" },
          "itemId": { "type": ["string", "null"], "description": "MD_TasklistMaterial.ItemKey" },
          "taskItemId": { "type": ["string", "null"], "description": "MD_TasklistMaterial.TaskItemID = operations[].taskItemId" },
          "operationNo": { "type": ["string", "null"], "description": "MD_TasklistMaterial.OperationNo, fx 0020" },
          "materialNo": { "type": "string", "minLength": 1, "description": "MD_TasklistMaterial.Title (vist som MaterialNo). Tekst - foranstillede nuller beholdes." },
          "quantity": { "type": ["number", "null"] },
          "unit": { "type": ["string", "null"] },
          "text": { "type": ["string", "null"], "description": "MD_TasklistMaterial.MaterialText" }
        }
      }
    },

    "strategyPackages": {
      "type": "array",
      "description": "Strategiens pakker: een raekke pr. raekke i MD_StrategyPackage med planens StrategyKey. Tom for en plan uden strategi. Opretteren tjekker operationernes pakker mod dem og regner startdatoen (foerste forfald minus den korteste pakke).",
      "items": {
        "type": "object",
        "required": ["packageNo"],
        "additionalProperties": false,
        "properties": {
          "packageNo": { "type": "integer", "description": "MD_StrategyPackage.PackageNo = tallet i operations[].packagesKey og pakkens kolonne i SAP's pakkeoversigt" },
          "shortCode": { "type": ["string", "null"], "description": "MD_StrategyPackage.ShortCode, fx 6M" },
          "cycleLength": { "type": ["number", "null"], "description": "MD_StrategyPackage.CycleLength" },
          "cycleUnit": { "type": ["string", "null"], "description": "MD_StrategyPackage.CycleUnit: DAY, WK, MON, YR (tid) eller H, D, COUNT (taeller; D er taellerdage)" },
          "hierarchy": { "type": ["number", "null"], "description": "MD_StrategyPackage.Hierarchy" },
          "text": { "type": ["string", "null"], "description": "MD_StrategyPackage.PackageText" },
          "offsetValue": { "type": ["number", "null"], "description": "MD_StrategyPackage.OffsetValue" }
        }
      }
    }
  }
}
