{
  "kind": "vhplan-sap-order",
  "version": 1,
  "orderGuid": "3f2b8c1e-9d4a-4e6b-8a7c-5d1e2f3a4b5c",
  "createdOn": "2026-10-02T08:42:33Z",
  "environment": "DEV",
  "site": "https://orsted.sharepoint.com/teams/BioSAPDev",
  "plan": {
    "spId": 138,
    "planId": "MP0133",
    "status": "Ready for creation in SAP",
    "title": "SSV HFC kulmøller - ugentlig kontrol",
    "plant": "SSV",
    "strategyKey": null,
    "cycle": 1,
    "unit": "WK",
    "plannedDate": "2027-09-20",
    "sortField": "080",
    "sortFieldId": 3,
    "schedulingPeriod": null,
    "requesterName": "Rekvirent Eksempel",
    "requesterEmail": "rekvirent@example.com",
    "appLink": "https://apps.powerapps.com/play/e/<miljoe-id>/a/<app-id>?ID=138"
  },
  "items": [
    {
      "spId": 185,
      "itemId": "MI0179",
      "title": "HFC kulmølle 1 - kontrol af tætninger",
      "longText": "<div class=\"ExternalClassF8582DF927F84C028ECE31C69A416790\"><p><strong>Formål:</strong> kontrol af tætninger og lejer.</p><ul><li>Kontrollér for lækager</li><li>Mål lejetemperatur<ul><li>Notér værdien i loggen</li></ul></li></ul></div>",
      "functionalLocation": "SSV13 HFC10",
      "objectList": "SSV13 HFC20AT002; SSV13 HFC20AZ001",
      "orderType": "ZPRE",
      "activityType": "101 - Maintenance",
      "mainWorkCenter": "SSVSUP",
      "priority": "Yellow (default)",
      "userStatus": "REPL",
      "nonFlowUserStatus": null,
      "revision": false,
      "revisionMark": null,
      "responsibleInitials": "EKSEM"
    },
    {
      "spId": 186,
      "itemId": "MI0180",
      "title": "HFC kulmølle 2 - kontrol af tætninger",
      "longText": "<div class=\"ExternalClass0B7E87AD9C9540A3A23747AF8D666ED2\">Som kulmølle 1.</div>",
      "functionalLocation": "SSV13 HFC10AB030",
      "objectList": null,
      "orderType": "ZPRE",
      "activityType": "101 - Maintenance",
      "mainWorkCenter": "SSVSUP",
      "priority": "Yellow (default)",
      "userStatus": "REPL",
      "nonFlowUserStatus": null,
      "revision": false,
      "revisionMark": null,
      "responsibleInitials": "EKSEM"
    }
  ],
  "operations": [
    {
      "spId": 436, "taskItemId": "TI0435", "itemSpId": 185, "itemId": "MI0179", "operationNo": 10,
      "shortText": "Timer til tilrettelæggelse", "longText": null,
      "workCenter": "SSVAP", "controlKey": "PM01", "work": 1, "persons": 1, "duration": 1,
      "vendor": "0", "price": 0, "currency": "DKK", "costElement": 3300010, "materialGroup": "999", "packagesKey": ";"
    },
    {
      "spId": 437, "taskItemId": "TI0436", "itemSpId": 185, "itemId": "MI0179", "operationNo": 20,
      "shortText": "Supervisor timer", "longText": null,
      "workCenter": "SSVSUP", "controlKey": "ZB01", "work": 4, "persons": 2, "duration": 2,
      "vendor": "0", "price": 0, "currency": "DKK", "costElement": 3300010, "materialGroup": null, "packagesKey": ";"
    },
    {
      "spId": 438, "taskItemId": "TI0437", "itemSpId": 185, "itemId": "MI0179", "operationNo": 30,
      "shortText": "Stillads op:", "longText": "<p>Stilladset skal være godkendt <u>før</u> arbejdet starter.</p>",
      "workCenter": "SSVXSTIL", "controlKey": "PM03", "work": 100, "persons": 1, "duration": 100,
      "vendor": "186572", "price": 49400, "currency": "DKK", "costElement": 3300010, "materialGroup": "F01.02", "packagesKey": ";"
    },
    {
      "spId": 439, "taskItemId": "TI0438", "itemSpId": 185, "itemId": "MI0179", "operationNo": 170,
      "shortText": "Udskiftning af pakninger (fast pris)", "longText": null,
      "workCenter": "SSVLEV", "controlKey": "PM02", "work": 1, "persons": 1, "duration": 1,
      "vendor": "12654", "price": 5000, "currency": "DKK", "costElement": 3300010, "materialGroup": "B08.04", "packagesKey": ";"
    },
    {
      "spId": 440, "taskItemId": "TI0439", "itemSpId": 186, "itemId": "MI0180", "operationNo": 10,
      "shortText": "Timer til tilrettelæggelse", "longText": null,
      "workCenter": "SSVAP", "controlKey": "PM01", "work": 1, "persons": 1, "duration": 1,
      "vendor": "0", "price": 0, "currency": "DKK", "costElement": 3300010, "materialGroup": "999", "packagesKey": ";"
    },
    {
      "spId": 441, "taskItemId": "TI0440", "itemSpId": 186, "itemId": "MI0180", "operationNo": 20,
      "shortText": "Supervisor timer", "longText": null,
      "workCenter": "SSVSUP", "controlKey": "PM01", "work": 2, "persons": 1, "duration": 2,
      "vendor": "0", "price": 0, "currency": "DKK", "costElement": 3300010, "materialGroup": null, "packagesKey": ";"
    },
    {
      "spId": 442, "taskItemId": "TI0441", "itemSpId": 186, "itemId": "MI0180", "operationNo": 30,
      "shortText": "Stillads op:", "longText": null,
      "workCenter": "SSVXSTIL", "controlKey": "PM03", "work": 7, "persons": 2, "duration": 3.5,
      "vendor": "186572", "price": 3458, "currency": "DKK", "costElement": 3300010, "materialGroup": "F01.02", "packagesKey": ";"
    }
  ],
  "materials": [
    {
      "spId": 6, "itemId": "MI0179", "taskItemId": "TI0438", "operationNo": "0170",
      "materialNo": "000000000010203945", "quantity": 2, "unit": "ST", "text": "Pakningssæt"
    }
  ]
}
